{
  "audit_version": 3,
  "kind": "repository_license_redistribution_evidence",
  "observed_at": "2026-07-27T19:50:34.086224Z",
  "outcomes_consulted": false,
  "repository_count": 302,
  "redistribution_counts": {
    "no_declared_license": 6,
    "open_source": 295,
    "proprietary": 1
  },
  "records": [
    {
      "canonical_repository_id": "0x4d31/galah",
      "manifest_license_status": "declared",
      "spdx_id": "Apache-2.0",
      "redistribution_class": "open_source",
      "license_expression": "Apache-2.0",
      "override_applied": false,
      "mirror_transport_url": null,
      "mirror_transport_cutoff_oid": null,
      "evidence": {
        "kind": "frozen_source_license_metadata",
        "url": "https://github.com/0x4D31/galah",
        "sha256": null,
        "summary": "Frozen source metadata records a declared license."
      }
    },
    {
      "canonical_repository_id": "0xfurai/peekaping",
      "manifest_license_status": "declared",
      "spdx_id": "MIT",
      "redistribution_class": "open_source",
      "license_expression": "MIT",
      "override_applied": false,
      "mirror_transport_url": null,
      "mirror_transport_cutoff_oid": null,
      "evidence": {
        "kind": "frozen_source_license_metadata",
        "url": "https://github.com/0xfurai/peekaping",
        "sha256": null,
        "summary": "Frozen source metadata records a declared license."
      }
    },
    {
      "canonical_repository_id": "2dust/v2rayn",
      "manifest_license_status": "declared",
      "spdx_id": "GPL-3.0",
      "redistribution_class": "open_source",
      "license_expression": "GPL-3.0",
      "override_applied": false,
      "mirror_transport_url": null,
      "mirror_transport_cutoff_oid": null,
      "evidence": {
        "kind": "frozen_source_license_metadata",
        "url": "https://github.com/2dust/v2rayN",
        "sha256": null,
        "summary": "Frozen source metadata records a declared license."
      }
    },
    {
      "canonical_repository_id": "3b1b/manim",
      "manifest_license_status": "declared",
      "spdx_id": "MIT",
      "redistribution_class": "open_source",
      "license_expression": "MIT",
      "override_applied": false,
      "mirror_transport_url": null,
      "mirror_transport_cutoff_oid": null,
      "evidence": {
        "kind": "frozen_source_license_metadata",
        "url": "https://github.com/3b1b/manim",
        "sha256": null,
        "summary": "Frozen source metadata records a declared license."
      }
    },
    {
      "canonical_repository_id": "a16z/halmos",
      "manifest_license_status": "declared",
      "spdx_id": "AGPL-3.0",
      "redistribution_class": "open_source",
      "license_expression": "AGPL-3.0",
      "override_applied": false,
      "mirror_transport_url": null,
      "mirror_transport_cutoff_oid": null,
      "evidence": {
        "kind": "frozen_source_license_metadata",
        "url": "https://github.com/a16z/halmos",
        "sha256": null,
        "summary": "Frozen source metadata records a declared license."
      }
    },
    {
      "canonical_repository_id": "addyosmani/agent-skills",
      "manifest_license_status": "declared",
      "spdx_id": "MIT",
      "redistribution_class": "open_source",
      "license_expression": "MIT",
      "override_applied": false,
      "mirror_transport_url": null,
      "mirror_transport_cutoff_oid": null,
      "evidence": {
        "kind": "frozen_source_license_metadata",
        "url": "https://github.com/addyosmani/agent-skills",
        "sha256": null,
        "summary": "Frozen source metadata records a declared license."
      }
    },
    {
      "canonical_repository_id": "affaan-m/ecc",
      "manifest_license_status": "declared",
      "spdx_id": "MIT",
      "redistribution_class": "open_source",
      "license_expression": "MIT",
      "override_applied": false,
      "mirror_transport_url": null,
      "mirror_transport_cutoff_oid": null,
      "evidence": {
        "kind": "frozen_source_license_metadata",
        "url": "https://github.com/affaan-m/ECC",
        "sha256": null,
        "summary": "Frozen source metadata records a declared license."
      }
    },
    {
      "canonical_repository_id": "aftership/clickhouse-sql-parser",
      "manifest_license_status": "declared",
      "spdx_id": "MIT",
      "redistribution_class": "open_source",
      "license_expression": "MIT",
      "override_applied": false,
      "mirror_transport_url": null,
      "mirror_transport_cutoff_oid": null,
      "evidence": {
        "kind": "frozen_source_license_metadata",
        "url": "https://github.com/AfterShip/clickhouse-sql-parser",
        "sha256": null,
        "summary": "Frozen source metadata records a declared license."
      }
    },
    {
      "canonical_repository_id": "ag2ai/build-with-ag2",
      "manifest_license_status": "declared",
      "spdx_id": "Apache-2.0",
      "redistribution_class": "open_source",
      "license_expression": "Apache-2.0",
      "override_applied": false,
      "mirror_transport_url": null,
      "mirror_transport_cutoff_oid": null,
      "evidence": {
        "kind": "frozen_source_license_metadata",
        "url": "https://github.com/ag2ai/build-with-ag2",
        "sha256": null,
        "summary": "Frozen source metadata records a declared license."
      }
    },
    {
      "canonical_repository_id": "ai-shifu/ai-shifu",
      "manifest_license_status": "declared",
      "spdx_id": "Apache-2.0",
      "redistribution_class": "open_source",
      "license_expression": "Apache-2.0",
      "override_applied": false,
      "mirror_transport_url": null,
      "mirror_transport_cutoff_oid": null,
      "evidence": {
        "kind": "frozen_source_license_metadata",
        "url": "https://github.com/ai-shifu/ai-shifu",
        "sha256": null,
        "summary": "Frozen source metadata records a declared license."
      }
    },
    {
      "canonical_repository_id": "airbytehq/airbyte",
      "manifest_license_status": "declared",
      "spdx_id": "NOASSERTION",
      "redistribution_class": "open_source",
      "license_expression": "NOASSERTION",
      "override_applied": false,
      "mirror_transport_url": null,
      "mirror_transport_cutoff_oid": null,
      "evidence": {
        "kind": "frozen_source_license_metadata",
        "url": "https://github.com/airbytehq/airbyte",
        "sha256": null,
        "summary": "Frozen source metadata records a declared license."
      }
    },
    {
      "canonical_repository_id": "airbytehq/pyairbyte",
      "manifest_license_status": "declared",
      "spdx_id": "NOASSERTION",
      "redistribution_class": "open_source",
      "license_expression": "NOASSERTION",
      "override_applied": false,
      "mirror_transport_url": null,
      "mirror_transport_cutoff_oid": null,
      "evidence": {
        "kind": "frozen_source_license_metadata",
        "url": "https://github.com/airbytehq/PyAirbyte",
        "sha256": null,
        "summary": "Frozen source metadata records a declared license."
      }
    },
    {
      "canonical_repository_id": "alacritty/alacritty",
      "manifest_license_status": "declared",
      "spdx_id": "Apache-2.0",
      "redistribution_class": "open_source",
      "license_expression": "Apache-2.0",
      "override_applied": false,
      "mirror_transport_url": null,
      "mirror_transport_cutoff_oid": null,
      "evidence": {
        "kind": "frozen_source_license_metadata",
        "url": "https://github.com/alacritty/alacritty",
        "sha256": null,
        "summary": "Frozen source metadata records a declared license."
      }
    },
    {
      "canonical_repository_id": "aldinokemal/go-whatsapp-web-multidevice",
      "manifest_license_status": "declared",
      "spdx_id": "MIT",
      "redistribution_class": "open_source",
      "license_expression": "MIT",
      "override_applied": false,
      "mirror_transport_url": null,
      "mirror_transport_cutoff_oid": null,
      "evidence": {
        "kind": "frozen_source_license_metadata",
        "url": "https://github.com/aldinokemal/go-whatsapp-web-multidevice",
        "sha256": null,
        "summary": "Frozen source metadata records a declared license."
      }
    },
    {
      "canonical_repository_id": "alexanderjeurissen/ranger_devicons",
      "manifest_license_status": "declared",
      "spdx_id": "GPL-3.0",
      "redistribution_class": "open_source",
      "license_expression": "GPL-3.0",
      "override_applied": false,
      "mirror_transport_url": null,
      "mirror_transport_cutoff_oid": null,
      "evidence": {
        "kind": "frozen_source_license_metadata",
        "url": "https://github.com/alexanderjeurissen/ranger_devicons",
        "sha256": null,
        "summary": "Frozen source metadata records a declared license."
      }
    },
    {
      "canonical_repository_id": "alirezamika/autoscraper",
      "manifest_license_status": "declared",
      "spdx_id": "MIT",
      "redistribution_class": "open_source",
      "license_expression": "MIT",
      "override_applied": false,
      "mirror_transport_url": null,
      "mirror_transport_cutoff_oid": null,
      "evidence": {
        "kind": "frozen_source_license_metadata",
        "url": "https://github.com/alirezamika/autoscraper",
        "sha256": null,
        "summary": "Frozen source metadata records a declared license."
      }
    },
    {
      "canonical_repository_id": "angular/angular",
      "manifest_license_status": "declared",
      "spdx_id": "MIT",
      "redistribution_class": "open_source",
      "license_expression": "MIT",
      "override_applied": false,
      "mirror_transport_url": null,
      "mirror_transport_cutoff_oid": null,
      "evidence": {
        "kind": "frozen_source_license_metadata",
        "url": "https://github.com/angular/angular",
        "sha256": null,
        "summary": "Frozen source metadata records a declared license."
      }
    },
    {